{
  "$schema": "https://json-schema.org/draft/2020-12/schema",
  "title": "computer",
  "type": "object",
  "additionalProperties": false,
  "required": [
    "$schema",
    "schema_version",
    "id",
    "record_type",
    "data"
  ],
  "properties": {
    "$schema": {
      "type": "string"
    },
    "schema_version": {
      "const": "2.0.0"
    },
    "id": {
      "type": "string",
      "minLength": 1
    },
    "record_type": {
      "const": "computer"
    },
    "data": {
      "type": "object",
      "required": [
        "compatible_software",
        "id",
        "introduced",
        "name",
        "category"
      ],
      "additionalProperties": false,
      "properties": {
        "availability": {
          "type": [
            "object"
          ]
        },
        "bom_assembly_refs": {
          "type": [
            "array"
          ]
        },
        "category": {
          "$ref": "urn:logix-aion:category:2"
        },
        "chipset": {
          "type": [
            "array"
          ]
        },
        "commercial_boundary": {
          "type": [
            "string"
          ]
        },
        "compatible_devices": {
          "type": [
            "array"
          ]
        },
        "compatible_software": {
          "type": [
            "array"
          ]
        },
        "customer_release_date": {
          "type": [
            "string"
          ]
        },
        "form_factor": {
          "type": [
            "string"
          ]
        },
        "graphics_card_ref": {
          "type": [
            "string"
          ],
          "minLength": 1
        },
        "id": {
          "type": [
            "string"
          ]
        },
        "introduced": {
          "type": [
            "object"
          ]
        },
        "io_and_expansion": {
          "type": [
            "object"
          ]
        },
        "lifecycle_policy": {
          "type": [
            "string"
          ]
        },
        "manufacturing_requirements": {
          "type": [
            "array"
          ]
        },
        "manufacturing_status": {
          "type": [
            "string"
          ]
        },
        "memory": {
          "type": [
            "object"
          ]
        },
        "monitor_and_keyboard_bundle": {
          "type": [
            "string"
          ]
        },
        "name": {
          "type": [
            "string"
          ]
        },
        "ncc_1982_display_upgrade": {
          "type": [
            "object"
          ]
        },
        "network": {
          "type": [
            "object"
          ]
        },
        "networking": {
          "type": [
            "object"
          ]
        },
        "networking_from_ncc_1981": {
          "type": [
            "object"
          ]
        },
        "operating_system_ref": {
          "type": [
            "string"
          ],
          "minLength": 1
        },
        "planning_file": {
          "type": [
            "string"
          ]
        },
        "positioning": {
          "type": [
            "string"
          ]
        },
        "processor": {
          "type": [
            "object"
          ]
        },
        "product_status": {
          "type": [
            "string"
          ]
        },
        "role": {
          "type": [
            "string"
          ]
        },
        "rom_and_cartridges": {
          "type": [
            "object"
          ]
        },
        "software_compatibility": {
          "type": [
            "object"
          ]
        },
        "software_policy": {
          "type": [
            "string"
          ]
        },
        "specification": {
          "type": [
            "object"
          ]
        },
        "storage": {
          "type": [
            "object"
          ]
        },
        "technology_refs": {
          "type": [
            "array"
          ]
        },
        "vendor": {
          "type": [
            "string"
          ]
        },
        "video": {
          "type": [
            "object"
          ]
        },
        "video_variants": {
          "type": [
            "array"
          ]
        }
      }
    }
  }
}
