{
  "$schema": "../../../schemas/records/computer.schema.json",
  "schema_version": "2.0.0",
  "id": "computer.athena_server",
  "record_type": "computer",
  "data": {
    "id": "computer.athena_server",
    "name": "Logix Athena Server",
    "introduced": {
      "event_name": "NCC 1983 — planned ERA² and Logix Athena premiere",
      "event_start_date": "1983-05-16",
      "date_precision": "day",
      "timeline_note": "Planned premiere on the opening day of NCC, 16–19 May 1983; not a confirmed shipment date."
    },
    "product_status": "Accepted planning baseline; production and electrical qualification pending.",
    "form_factor": "desktop/server chassis; mechanical design pending",
    "processor": {
      "part_ref": "part.era2",
      "variant": "ERA² baseline target",
      "clock_mhz": 12,
      "clock_status": "Target pending qualification"
    },
    "memory": {
      "ram_kb": 1024,
      "video_ram_kb": 64,
      "module_refs": [
        "part.ram_256kb_x32_2um"
      ],
      "modules_per_bank": 2,
      "bank_data_width_bits": 32,
      "ram_sockets": null,
      "maximum_ram_kb": null,
      "capacity_policy": "Installed configuration is specified; maximum board capacity/socket count remain open and are not the CPU address-space limit.",
      "configurations": [
        {
          "id": "base",
          "ram_kb": 1024,
          "module_ref": "part.ram_256kb_x32_2um",
          "populated_modules": 4,
          "populated_banks": 2,
          "data_chip_count": 128,
          "shipping_configuration": false,
          "planned_standard_configuration": true,
          "validation_status": "Accepted planning baseline; production and electrical qualification pending.",
          "bank_population": [
            {
              "bank": 0,
              "slots": [
                0,
                1
              ]
            },
            {
              "bank": 1,
              "slots": [
                2,
                3
              ]
            }
          ]
        }
      ],
      "default_configuration": "base",
      "os_rom": {
        "capacity_bytes": 262144,
        "execution": "Directly executable shared read-only AIONix2 code; private writable data and patch overlays in DRAM.",
        "implementation": "System ROM bank; physical mounting, chip organization and access timing pending qualification."
      },
      "population_policy": "Two matched 32-bit modules per capacity bank, selected independently on the 32-bit bus. Fill banks in order; all ranks require decoding and refresh. Cross-host connector/timing qualification pending."
    },
    "storage": {
      "internal_fdd": {
        "count": 1,
        "size_inch": 5.25,
        "sides": 2,
        "density": "double density",
        "format": "DS/DD",
        "formatted_capacity_kb": null
      },
      "hdd_included": true,
      "internal_hdd": {
        "count": 1,
        "capacity_mb": 20,
        "interface": null,
        "supplier": null
      }
    },
    "video": {
      "technology_ref": "technology.logix_digital_video",
      "api_ref": "technology.logix_display_api",
      "mode_discovery": "Enumerate controller modes intersected with identified or configured monitor raster capabilities and available buffering/sprite allocations. Reject unsupported downscaling.",
      "memory_layout": {
        "policy_ref": "technology.logix_display_api",
        "mode_exclusivity": "With palette-list mode enabled reserve 0xFA00–0xFFFF (1536 bytes); framebuffer/text/font allocations use 0x0000–0xF9FF. Text/font and bitmap layouts remain exclusive. Five sprites retain separate 1 KiB SRAM.",
        "font_policy": "One shared 256-glyph bank per mode. Font allocation 2048 bytes at 8×8, 4096 at 8×16 or 8×10 (16-byte glyph stride). Font writes affect both pages.",
        "page_flip": "Latch selected page during vertical blank; drawing throughput is not guaranteed by double buffering."
      },
      "controller_ref": "part.artemis_graphics_chip_64kb",
      "text_modes": [
        {
          "id": "text_40",
          "columns": 40,
          "rows": 25,
          "width": 320,
          "height": 200,
          "glyph_width": 8,
          "glyph_height": 8,
          "character_count": 256,
          "character_map_bytes_per_buffer": 1024,
          "attribute_map_bytes_per_buffer": 1024,
          "attribute_format": "4-bit foreground index + 4-bit background index",
          "font_bytes": 2048,
          "configurations": [
            {
              "text_buffer_count": 1,
              "sprite_count": 5,
              "allocated_bytes": 5632,
              "remaining_video_ram_bytes": 59904,
              "palette_list_bytes": 1536
            },
            {
              "text_buffer_count": 2,
              "sprite_count": 5,
              "allocated_bytes": 7680,
              "remaining_video_ram_bytes": 57856,
              "palette_list_bytes": 1536
            }
          ],
          "ram_bytes_per_page": 2048,
          "double_buffering": true,
          "sprites_available": 5,
          "required_raster_ids": [
            "raster_320_200",
            "raster_640_200",
            "raster_640_400"
          ]
        },
        {
          "id": "text_80",
          "columns": 80,
          "rows": 25,
          "width": 640,
          "height": 200,
          "glyph_width": 8,
          "glyph_height": 8,
          "character_count": 256,
          "character_map_bytes_per_buffer": 2048,
          "attribute_map_bytes_per_buffer": 2048,
          "attribute_format": "4-bit foreground index + 4-bit background index",
          "font_bytes": 2048,
          "configurations": [
            {
              "text_buffer_count": 1,
              "sprite_count": 5,
              "allocated_bytes": 7680,
              "remaining_video_ram_bytes": 57856,
              "palette_list_bytes": 1536
            },
            {
              "text_buffer_count": 2,
              "sprite_count": 5,
              "allocated_bytes": 11776,
              "remaining_video_ram_bytes": 53760,
              "palette_list_bytes": 1536
            }
          ],
          "ram_bytes_per_page": 4096,
          "double_buffering": true,
          "sprites_available": 5,
          "required_raster_ids": [
            "raster_640_200",
            "raster_640_400"
          ]
        },
        {
          "id": "text_80_25_400",
          "columns": 80,
          "rows": 25,
          "width": 640,
          "height": 400,
          "glyph_width": 8,
          "glyph_height": 16,
          "character_count": 256,
          "character_map_bytes_per_buffer": 2048,
          "attribute_map_bytes_per_buffer": 2048,
          "attribute_format": "4-bit foreground index + 4-bit background index",
          "font_bytes": 4096,
          "configurations": [
            {
              "text_buffer_count": 1,
              "sprite_count": 5,
              "allocated_bytes": 9728,
              "remaining_video_ram_bytes": 55808,
              "palette_list_bytes": 1536
            },
            {
              "text_buffer_count": 2,
              "sprite_count": 5,
              "allocated_bytes": 13824,
              "remaining_video_ram_bytes": 51712,
              "palette_list_bytes": 1536
            }
          ],
          "ram_bytes_per_page": 4096,
          "double_buffering": true,
          "sprites_available": 5,
          "required_raster_ids": [
            "raster_640_400"
          ]
        },
        {
          "id": "text_80_40_400",
          "columns": 80,
          "rows": 40,
          "width": 640,
          "height": 400,
          "glyph_width": 8,
          "glyph_height": 10,
          "character_count": 256,
          "character_map_bytes_per_buffer": 4096,
          "attribute_map_bytes_per_buffer": 4096,
          "attribute_format": "4-bit foreground index + 4-bit background index",
          "font_bytes": 4096,
          "configurations": [
            {
              "text_buffer_count": 1,
              "sprite_count": 5,
              "allocated_bytes": 13824,
              "remaining_video_ram_bytes": 51712,
              "palette_list_bytes": 1536
            },
            {
              "text_buffer_count": 2,
              "sprite_count": 5,
              "allocated_bytes": 22016,
              "remaining_video_ram_bytes": 43520,
              "palette_list_bytes": 1536
            }
          ],
          "ram_bytes_per_page": 8192,
          "double_buffering": true,
          "sprites_available": 5,
          "required_raster_ids": [
            "raster_640_400"
          ]
        }
      ],
      "bitmap_modes": [
        {
          "id": "graphics_a",
          "width": 640,
          "height": 200,
          "bits_per_pixel": 1,
          "bytes_per_framebuffer": 16000,
          "stride_bytes": 80,
          "configurations": [
            {
              "framebuffer_count": 1,
              "sprite_count": 5,
              "allocated_bytes": 17536,
              "remaining_video_ram_bytes": 48000,
              "palette_list_bytes": 1536
            },
            {
              "framebuffer_count": 2,
              "sprite_count": 5,
              "allocated_bytes": 33536,
              "remaining_video_ram_bytes": 32000,
              "palette_list_bytes": 1536
            }
          ],
          "compatibility_mode": false,
          "double_buffering": true,
          "sprites_available": 5,
          "required_raster_ids": [
            "raster_640_200",
            "raster_640_400"
          ]
        },
        {
          "id": "graphics_b2",
          "width": 320,
          "height": 200,
          "bits_per_pixel": 2,
          "bytes_per_framebuffer": 16000,
          "stride_bytes": 80,
          "configurations": [
            {
              "framebuffer_count": 1,
              "sprite_count": 5,
              "allocated_bytes": 17536,